title,description,location,url,img_url,coords,date
"36 Hours in Florence, Italy","See the skyline without battling crowds, sample pastries from a secret gem, sip artisanal beers and soak up culture during a weekend in the Tuscan capital.","Florence, Italy",https://www.nytimes.com/2014/09/28/travel/things-to-do-in-36-hours-in-florence-italy.html,https://static01.nyt.com/images/2014/09/28/travel/28HOURS/28HOURS-mediumSquare149-v2.jpg?quality=100&auto=webp,"(43.7697955, 11.2556404)",28/travel/09
"36 Hours in Cartagena, Colombia","From Old City strolls and sunset views to fried street snacks and late-night dancing, spend a weekend in this Caribbean city.","Cartagena, Colombia",https://www.nytimes.com/2014/09/14/travel/things-to-do-in-36-hours-in-cartagena-colombia.html,https://static01.nyt.com/images/2014/09/11/travel/36hours-cartagena-replacement-photo/36hours-cartagena-replacement-photo-mediumSquare149-v2.png?quality=100&auto=webp,"(10.4265566, -75.5441671)",14/travel/09
36 Hours in Nashville,"Sure, you can still tap your feet to a country beat in Music City, but keep exploring and you’ll find everything from enticing shops to a dynamic food scene.",Nashville,https://www.nytimes.com/2014/09/07/travel/things-to-do-in-36-hours-in-nashville.html,https://static01.nyt.com/images/2014/07/24/multimedia/36hours-nashville/36hours-nashville-mediumSquare149.jpg?quality=100&auto=webp,"(36.1622767, -86.7742984)",07/travel/09
"36 Hours in Charlotte, N.C.","Explore the “Queen City,” where downtown is Uptown, the Old South is new and the attractions range from bike routes to the Nascar Hall of Fame.","Charlotte, N.C.",https://www.nytimes.com/2014/08/31/travel/things-to-do-in-36-hours-in-charlotte-nc.html,https://static01.nyt.com/images/2014/08/31/travel/31-hours-top-sf/31-hours-top-mediumSquare149.jpg?quality=100&auto=webp,"(35.2272086, -80.8430827)",31/travel/08
36 Hours in Glasgow,"Whether you’re looking for art or music, shops or nature, a cup of tea or a dram of whisky, you can find it during a weekend in this city in western Scotland.",Glasgow,https://www.nytimes.com/2014/08/24/travel/36-hours-in-glasgow.html,https://static01.nyt.com/images/2014/08/19/multimedia/36hours-glasgow/36hours-glasgow-mediumSquare149-v6.jpg?quality=100&auto=webp,"(55.861155, -4.2501687)",24/travel/08
"36 Hours in Nice, France","A city for all budgets, Nice now buzzes with an energy and diversity that often surpasses its rivals on the Riviera.","Nice, France",https://www.nytimes.com/2014/08/17/travel/36-hours-in-nice-france.html,https://static01.nyt.com/images/2014/08/12/multimedia/36hours-nice/36hours-nice-mediumSquare149.jpg?quality=100&auto=webp,"(43.7009358, 7.2683912)",17/travel/08
"36 Hours: Lake Como, Italy","The views — from above, the shore or a boat — may steal the show, but there’s more to do in this area of northern Italy than simply gaze at the scenery.","Lake Como, Italy",https://www.nytimes.com/2014/08/10/travel/36-hours-lake-como-italy.html,https://static01.nyt.com/images/2014/08/10/travel/10-hours-promo/10-hours-promo-mediumSquare149.jpg?quality=100&auto=webp,"(45.9917589, 9.264881)",10/travel/08
"36 Hours in Green Bay, Wis.","There’s more to this town of 100,000 than just the Packers. Green Bay boasts everything from craft beer to a postcard-perfect amusement park to the National Railroad Museum.","Green Bay, Wis.",https://www.nytimes.com/2014/08/03/travel/36-hours-in-green-bay-wis.html,https://static01.nyt.com/images/2014/08/03/travel/03-hours-top-sf/03-hours-top-mediumSquare149.jpg?quality=100&auto=webp,"(44.5126379, -88.0125794)",03/travel/08
"36 Hours in Provincetown, Mass.","From seaside strolls to dance parties, street performances to gallery exhibits, you can find it all during a weekend on the tip of Cape Cod.","Provincetown, Mass.",https://www.nytimes.com/2014/07/27/travel/36-hours-in-provincetown-mass.html,https://static01.nyt.com/images/2014/07/27/travel/27-hours-top-sf/27-hours-top-mediumSquare149.jpg?quality=100&auto=webp,"(42.0525612, -70.1858639)",27/travel/07
"36 Hours in Dakar, Senegal","Browse markets and take in some live music, sip a cocktail with a view and take a boat to an island during a weekend in this West African city.","Dakar, Senegal",https://www.nytimes.com/2014/07/20/travel/36-hours-in-dakar-senegal.html,https://static01.nyt.com/images/2014/07/20/travel/20-hours-top/20-hours-top-mediumSquare149.jpg?quality=100&auto=webp,"(14.693425, -17.447938)",20/travel/07
"36 Hours in Graz, Austria","The country’s second-largest city, built around an ancient hilltop castle, boasts rich design, art and culinary scenes.","Graz, Austria",https://www.nytimes.com/2014/07/13/travel/36-hours-in-graz-austria.html,https://static01.nyt.com/images/2014/07/13/travel/13-hours-top-sf/13-hours-top-mediumSquare149.jpg?quality=100&auto=webp,"(47.0708678, 15.4382786)",13/travel/07
36 Hours in the Berkshires,Do you prefer nature or culture? Indulging in local food or burning it off? Choose your own combination during a weekend in western Massachusetts.,the Berkshires,https://www.nytimes.com/2014/07/06/travel/36-hours-in-the-berkshires.html,https://static01.nyt.com/images/2014/07/06/travel/06-hours-promo-sf/06-hours-promo-mediumSquare149.jpg?quality=100&auto=webp,"(42.4579115, -73.2460792)",06/travel/07
36 Hours in Stockholm,"The center of the Swedish capital is lovely and historic, but there are new galleries, boutiques and breweries farther out worth exploring.",Stockholm,https://www.nytimes.com/2014/06/29/travel/36-hours-in-stockholm.html,https://static01.nyt.com/images/2014/06/29/travel/29HOURS1/29HOURS1-mediumSquare149.jpg?quality=100&auto=webp,"(59.3251172, 18.0710935)",29/travel/06
36 Hours in Madrid,"Shop for handmade shoes and edible souvenirs, sample cocktails and cuisine and go on a cultural crawl during a weekend in the Spanish capital.",Madrid,https://www.nytimes.com/2014/06/22/travel/36-hours-in-madrid.html,https://static01.nyt.com/images/2014/06/22/travel/22-hours-combo/22-hours-combo-mediumSquare149.jpg?quality=100&auto=webp,"(40.416782, -3.703507)",22/travel/06
36 Hours in Venice,"Sip and snack canalside, indulge in gelato for breakfast and forage for not-so-touristy souvenirs during a weekend in northern Italy.",Venice,https://www.nytimes.com/2014/06/15/travel/36-hours-in-venice.html,https://static01.nyt.com/images/2014/06/15/travel/15-hours-top-sf/15-hours-top-mediumSquare149.jpg?quality=100&auto=webp,"(45.4371908, 12.3345898)",15/travel/06
"36 Hours in Canberra, Australia","In the country’s capital, situated between Sydney and Melbourne, you’ll find everything from culture to cycling, political history to panoramic views.","Canberra, Australia",https://www.nytimes.com/2014/06/08/travel/36-hours-in-canberra-australia.html,https://static01.nyt.com/images/2014/06/08/travel/08-hours-top/08-hours-top-mediumSquare149.jpg?quality=100&auto=webp,"(-35.2975906, 149.1012676)",08/travel/06
"36 Hours in Montevideo, Uruguay","During a weekend in the capital city, sample everything from meat to music to museums.","Montevideo, Uruguay",https://www.nytimes.com/2014/05/25/travel/36-hours-in-montevideo-uruguay.html,https://static01.nyt.com/images/2014/05/25/travel/25-hours-promo/25-hours-promo-mediumSquare149.jpg?quality=100&auto=webp,"(-34.9058916, -56.1913095)",25/travel/05
"36 Hours in Washington, D.C.","From flowers to fried oysters, shopping to shakes, spend a weekend exploring in the shadow of the Capitol.","Washington, D.C.",https://www.nytimes.com/2014/05/18/travel/36-hours-in-washington-dc.html,https://static01.nyt.com/images/2014/05/18/travel/18-hours-top-sf/18-hours-top-mediumSquare149.jpg?quality=100&auto=webp,"(38.8950368, -77.0365427)",18/travel/05
"36 Hours in Ho Chi Minh City, Vietnam","Take a tour on a vintage Vespa, pair a cocktail with a view and peer through a window to the past in Vietnam’s largest metropolis.","Ho Chi Minh City, Vietnam",https://www.nytimes.com/2014/05/11/travel/36-hours-in-ho-chi-minh-city-vietnam.html,https://static01.nyt.com/images/2014/05/11/travel/11-hours-top-sf/11-hours-top-mediumSquare149.jpg?quality=100&auto=webp,"(10.7755254, 106.7021047)",11/travel/05
"36 Hours in Zanzibar, Tanzania","Venture off the eastern coast of Tanzania to stroll through historic Stone Town, listen to a celebrated local music genre and sample one of Zanzibar’s spectacular beaches.","Zanzibar, Tanzania",https://www.nytimes.com/2014/05/04/travel/36-hours-in-zanzibar-tanzania.html,https://static01.nyt.com/images/2014/05/04/travel/04-hours-span-sf/04-hours-span-mediumSquare149.jpg?quality=100&auto=webp,"(-6.1664908, 39.2074312)",04/travel/05
"36 Hours in Belo Horizonte, Brazil",The World Cup is coming soon to this lively industrial capital of Brazil’s second most populous state. Here’s some of what soccer fans — and other visitors — can expect to find.,"Belo Horizonte, Brazil",https://www.nytimes.com/2014/04/27/travel/36-hours-in-belo-horizonte-brazil.html,https://static01.nyt.com/images/2014/04/27/travel/27-hours-span-sf/27-hours-span-mediumSquare149.jpg?quality=100&auto=webp,"(-19.9227318, -43.9450948)",27/travel/04
36 Hours in Prague,"Many locals still haven’t heard of all the next big things: flashy new art galleries, dynamically developing old neighborhoods, great bars — beyond and including beer — and new restaurants.",Prague,https://www.nytimes.com/2014/04/20/travel/36-hours-in-prague.html,https://static01.nyt.com/images/2014/04/20/travel/20-hours-span-sf/20-hours-span-mediumSquare149.jpg?quality=100&auto=webp,"(50.0874654, 14.4212535)",20/travel/04
"36 Hours in Seville, Spain","Go on a tapas crawl, take a high-tech tour and even do a little late-night dancing during a weekend in the Andalusian capital.","Seville, Spain",https://www.nytimes.com/2014/04/13/travel/36-hours-in-seville-spain.html,https://static01.nyt.com/images/2014/04/13/travel/13-hours-span-sf/13-hours-span-mediumSquare149.jpg?quality=100&auto=webp,"(37.3886303, -5.9953403)",13/travel/04
"36 Hours in Hood River, Ore.","Whether you’re into beer or biking, wine or water sports, you can indulge in this area on the Columbia River east of Portland.","Hood River, Ore.",https://www.nytimes.com/2014/04/06/travel/36-hours-in-hood-river-ore.html,https://static01.nyt.com/images/2014/04/06/travel/06-hours-span-sf/06-hours-span-mediumSquare149.jpg?quality=100&auto=webp,"(45.5311636, -121.6475587)",06/travel/04
36 Hours in Jamaica,"Start in Kingston for cocktails and culture, then head north through verdant landscapes to sample Jamaican cuisine and catch some sun by the sea.",Jamaica,https://www.nytimes.com/2014/03/30/travel/36-hours-in-jamaica.html,https://static01.nyt.com/images/2014/03/30/travel/30-hours-span-sf/30-hours-span-mediumSquare149.jpg?quality=100&auto=webp,"(18.1850507, -77.3947693)",30/travel/03
36 Hours in Mexico City,"Where to begin in the nearly 500-year-old capital? This weekend itinerary can get you started, with stops at museums and markets, bars and bell towers.",Mexico City,https://www.nytimes.com/2014/03/23/travel/36-hours-in-mexico-city.html,https://static01.nyt.com/images/2014/03/23/travel/23-hours-span/23-hours-span-mediumSquare149.jpg?quality=100&auto=webp,"(19.4326296, -99.1331785)",23/travel/03
"36 Hours in Nassau, the Bahamas","From beaches and birds to conch and cocktails, warm up with a weekend in this laid-back island town.","Nassau, the Bahamas",https://www.nytimes.com/2014/03/16/travel/36-hours-in-nassau-the-bahamas.html,https://static01.nyt.com/images/2014/03/16/travel/16-hours-span/16-hours-span-mediumSquare149.jpg?quality=100&auto=webp,"(25.0782266, -77.3383438)",16/travel/03
"36 Hours in Raleigh, N.C.","North Carolina’s capital is awash with entrepreneurial energy, from clothing labels to craft breweries to ambitious restaurants.","Raleigh, N.C.",https://www.nytimes.com/2014/03/09/travel/36-hours-in-raleigh-nc.html,https://static01.nyt.com/images/2014/03/09/travel/09HOURS_SPAN-sf/0309HOURS01-mediumSquare149.jpg?quality=100&auto=webp,"(35.7803977, -78.6390989)",09/travel/03
"36 Hours in Kyoto, Japan","Explore shrines and temples, browse design shops, sample deep-fried food on skewers and more during a weekend in Japan’s former imperial capital.","Kyoto, Japan",https://www.nytimes.com/2014/03/02/travel/36-hours-in-kyoto-japan.html,https://static01.nyt.com/images/2014/03/02/travel/02HOURS1/02HOURS1-mediumSquare149.jpg?quality=100&auto=webp,"(35.0115754, 135.7681441)",02/travel/03
"36 Hours in Baton Rouge, La.","It may not be the nonstop party of New Orleans, but Louisiana’s capital city offers plenty, from food to history to the arts.","Baton Rouge, La.",https://www.nytimes.com/2014/02/16/travel/36-hours-in-baton-rouge-la.html,https://static01.nyt.com/images/2014/02/16/travel/16-hours-span/16-hours-span-mediumSquare149.jpg?quality=100&auto=webp,"(30.4494155, -91.1869659)",16/travel/02
"36 Hours in Yangon, Myanmar","The major city of a complicated country, Yangon is hoping to become Southeast Asia’s next boomtown. What can you find during a visit in the meantime? Here’s a look.","Yangon, Myanmar",https://www.nytimes.com/2014/02/09/travel/36-hours-in-yangon-myanmar.html,https://static01.nyt.com/images/2014/02/09/travel/09-hours-span-sf/09-hours-span-mediumSquare149.jpg?quality=100&auto=webp,"(16.7967129, 96.1609916)",09/travel/02
"36 Hours in Manchester, Vt.","From sleigh rides to shopping, crafts to cuisine, you can find it during a weekend in this southern Vermont town.","Manchester, Vt.",https://www.nytimes.com/2014/02/02/travel/36-hours-in-manchester-vt.html,https://static01.nyt.com/images/2014/02/02/travel/02-hours-span/02-hours-span-mediumSquare149.jpg?quality=100&auto=webp,"(43.176909, -73.0568716)",02/travel/02
"36 Hours in Basel, Switzerland","From bars and boutiques to culture and cuisine, this small city near France and Germany offers plenty to pack into a weekend.","Basel, Switzerland",https://www.nytimes.com/2014/01/26/travel/36-hours-in-basel-switzerland.html,https://static01.nyt.com/images/2014/01/26/travel/26-hours-promo/26-hours-promo-mediumSquare149.jpg?quality=100&auto=webp,"(47.5581077, 7.5878261)",26/travel/01
36 Hours in Sydney,"Hit golden beaches, soak up contemporary culture, explore atmospheric bars and, sure, catch a glimpse of that opera house during a weekend in Australia’s most populous city.",Sydney,https://www.nytimes.com/2014/01/19/travel/36-hours-in-sydney.html,https://static01.nyt.com/images/2014/01/19/travel/19-hours-span/19-hours-span-mediumSquare149.jpg?quality=100&auto=webp,"(-33.8698439, 151.2082848)",19/travel/01
36 Hours in Chicago,"From the historic high-rises of the Gold Coast to regal Hyde Park, to the bohemian barrios of Logan Square and Pilsen, Chicago demands hard choices.",Chicago,https://www.nytimes.com/2014/01/05/travel/36-hours-in-chicago.html,https://static01.nyt.com/images/2014/01/05/travel/05-hours-span-sf/05-hours-span-mediumSquare149.jpg?quality=100&auto=webp,"(41.8755616, -87.6244212)",05/travel/01
"36 Hours in South Beach, Miami Beach","Shivering in frosty temperatures where you are? Thaw out with a trip to South Beach, where the attractions extend far beyond the warm weather.","South Beach, Miami Beach",https://www.nytimes.com/2013/12/29/travel/36-hours-in-south-beach-miami-beach.html,https://static01.nyt.com/images/2013/12/29/travel/29-hours-span-sf/29-hours-span-mediumSquare149.jpg?quality=100&auto=webp,"(25.7744291, -80.1332415)",29/travel/12
"36 Hours in Jackson Hole, Wyo.","From skiing to sleigh rides to sculpture, you can find it in this area of dramatic beauty south of Yellowstone National Park.","Jackson Hole, Wyo.",https://www.nytimes.com/2013/12/22/travel/36-hours-in-jackson-hole-wyo.html,https://static01.nyt.com/images/2013/12/22/travel/22-hours-span/22-hours-span-moth.jpg?quality=100&auto=webp,"(43.684017, -110.4436629)",22/travel/12
"36 Hours in Colombo, Sri Lanka","Visitors often bolt from the capital soon after arriving, headed to Sri Lanka’s outdoorsy attractions. Here’s what they’re missing by not lingering a little longer.","Colombo, Sri Lanka",https://www.nytimes.com/2013/12/15/travel/36-hours-in-colombo-sri-lanka.html,https://static01.nyt.com/images/2013/12/15/travel/15HOURS_SPAN-sf/15HOURS2-moth.jpg?quality=100&auto=webp,"(6.9388614, 79.8542005)",15/travel/12
"36 Hours in Kauai, Hawaii",You could fill a weekend simply staring slack-jawed at this island’s natural beauty. But Kauai’s appeal stretches far beyond those arresting views.,"Kauai, Hawaii",https://www.nytimes.com/2013/12/08/travel/36-hours-in-kauai-hawaii.html,https://static01.nyt.com/images/2013/12/08/travel/08HOURS4/08HOURS4-moth.jpg?quality=100&auto=webp,"(22.0503838, -159.5588624)",08/travel/12
36 Hours in Shanghai,"Experience the past, present and future in this Chinese city, sampling everything from museums to street food to dancing in the park along the way.",Shanghai,https://www.nytimes.com/2013/12/01/travel/36-hours-in-shanghai.html,https://static01.nyt.com/images/2013/12/01/travel/01HOURS_SPAN-sf/01HOURS_SPAN-moth.jpg?quality=100&auto=webp,"(31.2312707, 121.4700152)",01/travel/12
"36 Hours in Chianti, Italy","Among the vineyards and olive groves are high-fashion and artisanal shops, sculpture gardens and Etruscan sites.","Chianti, Italy",https://www.nytimes.com/2013/11/17/travel/36-hours-in-chianti-italy.html,https://static01.nyt.com/images/2013/11/17/travel/20131117-36HOURS/20131117-36HOURS-slide-JI3J-moth.jpg?quality=100&auto=webp,"(43.5824597, 11.3168731)",17/travel/11
36 Hours in Aruba,"You can settle in with a book and a beer on the beach, but if you prefer a more active itinerary, this sunny Dutch island offers everything from cultural exploration to beach tennis.",Aruba,https://www.nytimes.com/2013/11/10/travel/36-hours-in-aruba.html,https://static01.nyt.com/images/2013/11/10/travel/10-hours-span/10-hours-span-moth.jpg?quality=100&auto=webp,"(12.5013629, -69.9618475)",10/travel/11
"36 Hours in Düsseldorf, Germany","No, it’s not Berlin or Munich, but this city on the Rhine has more than enough attractions to fill a rewarding weekend.","Düsseldorf, Germany",https://www.nytimes.com/2013/11/03/travel/36-hours-in-dusseldorf-germany.html,https://static01.nyt.com/images/2013/11/03/travel/03DUSSELDORF_COMBO-sf/03DUSSELDORF_COMBO-sf-moth-v3.jpg?quality=100&auto=webp,"(51.2254018, 6.7763137)",03/travel/11
36 Hours in Milwaukee,"Sausage, cheese and beer? Sure. But look around Wisconsin’s largest city and you’ll also find everything from books to art.",Milwaukee,https://www.nytimes.com/2013/10/27/travel/36-hours-in-milwaukee.html,https://static01.nyt.com/images/2013/10/27/travel/27HOURS1_SPAN-sf/27HOURS1_SPAN-moth-v2.jpg?quality=100&auto=webp,"(43.0386475, -87.9090751)",27/travel/10
"36 Hours in Cardiff, Wales","Dive deep into Welsh history, catch a performance at one of the city’s contemporary spaces or simply stroll along the waterfront during a weekend in the capital.","Cardiff, Wales",https://www.nytimes.com/2013/10/20/travel/36-hours-in-cardiff-wales.html,https://static01.nyt.com/images/2013/10/20/travel/20HOURS_SPAN/20HOURS-moth.jpg?quality=100&auto=webp,"(51.4816546, -3.1791934)",20/travel/10
"36 Hours in Sarajevo, Bosnia and Herzegovina",Creative energy and natural beauty mix with a complicated history during a weekend in this capital city.,"Sarajevo, Bosnia and Herzegovina",https://www.nytimes.com/2013/10/13/travel/36-hours-in-sarajevo-bosnia-and-herzegovina.html,https://static01.nyt.com/images/2013/10/13/travel/13-hours-span/13-hours-span-moth.jpg?quality=100&auto=webp,"(43.8570713, 18.4126147)",13/travel/10
"36 Hours in Antwerp, Belgium","Years ago, Antwerp established itself as a fashion hub, but this stylish city’s creativity extends far beyond clothes.","Antwerp, Belgium",https://www.nytimes.com/2013/10/06/travel/36-hours-in-antwerp-belgium.html,https://static01.nyt.com/images/2013/10/06/travel/06HOURS_SPAN-sf/06HOURS_SPAN-moth.jpg?quality=100&auto=webp,"(51.2211097, 4.3997081)",06/travel/10
"36 Hours in Hampstead, London","Pack a picnic for the Heath, stroll through chapters of history and even take a bracing dip during a weekend in London’s worst-kept, high-altitude secret.","Hampstead, London",https://www.nytimes.com/2013/09/29/travel/36-hours-in-hampstead-london.html,https://static01.nyt.com/images/2013/09/29/travel/29HOURS_SPAN/29HOURS_SPAN-moth.jpg?quality=100&auto=webp,"(51.55653, -0.1783011)",29/travel/09
36 Hours in Reykjavik,"See the city’s award-winning new architectural landmark, stay up (very) late on a pub crawl, find peace on a nearby island and far more during a weekend in Iceland’s capital.",Reykjavik,https://www.nytimes.com/2013/09/22/travel/36-hours-in-reykjavik.html,https://static01.nyt.com/images/2013/09/22/travel/22HOURS_SPAN/22HOURS1-moth.jpg?quality=100&auto=webp,"(64.145981, -21.9422367)",22/travel/09
36 Hours in Buenos Aires,"Dine in a private supper club, tour a renowned opera house and soak up some nature by the Río de la Plata during a weekend in Argentina’s capital.",Buenos Aires,https://www.nytimes.com/2013/09/15/travel/36-hours-in-buenos-aires.html,https://static01.nyt.com/images/2013/09/15/travel/15HOURS_SPAN-sf/15HOURS_SPAN-moth-v2.jpg?quality=100&auto=webp,"(-34.6095579, -58.3887904)",15/travel/09
36 Hours in Berlin,"In the evolving German capital, where neighborhoods are being transformed, there are fresh spots to see art, sip cocktails and savor a bite.",Berlin,https://www.nytimes.com/2013/09/08/travel/36-hours-in-berlin.html,https://static01.nyt.com/images/2013/09/08/travel/08-hours-span/08-hours-span-moth.jpg?quality=100&auto=webp,"(52.5173885, 13.3951309)",08/travel/09
36 Hours in the Brandywine Valley,"Just a couple of hours from Manhattan, this area offers everything from Revolutionary War history and art by the Wyeths to rolling hills and manicured estates.",the Brandywine Valley,https://www.nytimes.com/2013/09/01/travel/36-hours-in-the-brandywine-valley-pa.html,https://static01.nyt.com/images/2013/09/01/travel/01-hours-span/01-hours-span-moth.jpg?quality=100&auto=webp,"(39.7470348, -75.5473339)",01/travel/09
"36 Hours in Izmir, Turkey","This sunny seaside city offers everything from a traditional bazaar to bars to boutiques, and serves as a gateway to the ruins of ancient Ephesus.","Izmir, Turkey",https://www.nytimes.com/2013/08/25/travel/36-hours-in-izmir-turkey.html,https://static01.nyt.com/images/2013/08/25/travel/25HOURS2/25HOURS2-moth-v2.jpg?quality=100&auto=webp,"(38.23166, 27.02997)",25/travel/08
36 Hours in Monaco,"You can give your wallet a wild ride in this diminutive constitutional monarchy, but there is also a world of affordable fun to be found.",Monaco,https://www.nytimes.com/2013/08/18/travel/36-hours-in-monaco.html,https://static01.nyt.com/images/2013/08/12/travel/1836HOURS_SPAN-sf/1836HOURS_SPAN-moth.jpg?quality=100&auto=webp,"(43.7323492, 7.4276832)",18/travel/08
"36 Hours in Lecce, Italy","Stroll past churches, take a midday break at the beach and sip a glass of regional wine in the “Florence of the South.”","Lecce, Italy",https://www.nytimes.com/2013/08/11/travel/36-hours-in-lecce-italy.html,https://static01.nyt.com/images/2013/08/11/travel/11HOURS_SPAN-sf/11HOURS_SPAN-moth.jpg?quality=100&auto=webp,"(40.1522173, 18.2260628)",11/travel/08
"36 Hours in Portsmouth, N.H.","This small waterfront town, settled in 1623, boasts a range of options to fill a weekend, from brews to books to boats.","Portsmouth, N.H.",https://www.nytimes.com/2013/08/04/travel/36-hours-in-portsmouth-nh.html,https://static01.nyt.com/images/2013/08/04/travel/04HOURS_SPAN-sf/04HOURS1-moth.jpg?quality=100&auto=webp,"(43.0751306, -70.7601826)",04/travel/08
"36 Hours in the Hudson Valley, New York","From art and antiques to history and hiking to restaurants and river views, get ready for a packed weekend in this region north of New York City.","the Hudson Valley, New York",https://www.nytimes.com/2013/07/28/travel/36-hours-in-the-hudson-valley-new-york.html,https://static01.nyt.com/images/2013/07/28/travel/28-hours-span-sf/28-hours-span-moth.jpg?quality=100&auto=webp,"(41.3146889, -74.1253171)",28/travel/07
"36 Hours in Hilton Head Island, S.C.","Sure, you could spend a weekend pitching and putting in this golfing paradise. But look at all you’d be missing.","Hilton Head Island, S.C.",https://www.nytimes.com/2013/07/21/travel/36-hours-in-hilton-head-island-sc.html,https://static01.nyt.com/images/2013/07/21/travel/21HILTONHEAD_SPAN-sf/21HILTONHEAD_SPAN-moth-v2.jpg?quality=100&auto=webp,"(32.1618488, -80.7512616)",21/travel/07
36 Hours in Edinburgh,"Walk up the Royal Mile, browse portraits of famous Scots and pop in for a pint during a weekend in Scotland’s capital.",Edinburgh,https://www.nytimes.com/2013/07/14/travel/36-hours-in-edinburgh.html,https://static01.nyt.com/images/2013/07/14/travel/14EDINBURGH_SPAN-sf/14EDINBURGH_SPAN-moth.jpg?quality=100&auto=webp,"(55.9533456, -3.1883749)",14/travel/07
36 Hours in Munich,"While the city’s beer gardens are as lively as ever, Munich is pushing to challenge Berlin as Germany’s cultural capital.",Munich,https://www.nytimes.com/2013/07/07/travel/36-hours-in-munich.html,https://static01.nyt.com/images/2013/07/07/travel/07-hours-span/07-hours-span-moth.jpg?quality=100&auto=webp,"(48.1371079, 11.5753822)",07/travel/07
"36 Hours in Gettysburg, Pa.","As crowds descend on this small town to mark the battle’s 150th anniversary, here’s a look at what they’ll find, from history to dining to wine.","Gettysburg, Pa.",https://www.nytimes.com/2013/06/30/travel/36-hours-in-gettysburg-pa.html,https://static01.nyt.com/images/2013/06/30/travel/30HOURS_SPAN/30HOURS_SPAN-moth-v2.jpg?quality=100&auto=webp,"(39.8308973, -77.231012)",30/travel/06
