title,description,location,url,img_url,coords,date
"36 Hours in Sydney, Australia","Venture past Sydney’s Central Business District to where residents live and play, and you’ll discover that the city’s heart is nowhere near the center of town.","Sydney, Australia",https://www.nytimes.com/interactive/2016/12/08/travel/what-to-do-36-hours-in-sydney-australia.html,https://static01.nyt.com/images/2016/12/11/travel/11HOURS-SYDNEY1/11HOURS-SYDNEY1-mediumSquare149.jpg?quality=100&auto=webp,"(-33.8698439, 151.2082848)",12/08/2016
36 Hours in Geneva,"Don’t underestimate under-the-radar Geneva. This scenic city offers quirky museums, outdoor markets, great shopping and a creative food scene.",Geneva,https://www.nytimes.com/interactive/2016/12/01/travel/what-to-do-36-hours-in-geneva-switzerland.html,https://static01.nyt.com/images/2016/12/04/travel/04HOURS-GENEVA1/04HOURS-GENEVA1-mediumSquare149.jpg?quality=100&auto=webp,"(46.2017559, 6.1466014)",12/01/2016
36 Hours in Delhi,"Explore the city’s innumerable charms — ruin-studded gardens, a growing contemporary art scene, diverse regional cuisines.",Delhi,https://www.nytimes.com/interactive/2016/11/24/travel/what-to-do-36-hours-in-delhi-india.html,https://static01.nyt.com/images/2016/11/27/travel/27DEHLI-LISTY2/27DEHLI-LISTY2-mediumSquare149.jpg?quality=100&auto=webp,"(28.6328027, 77.2197713)",11/24/2016
36 Hours in Miami and Miami Beach,"Once again, the Miami area is reinventing itself, this time as a cultural and culinary hot spot.",Miami and Miami Beach,https://www.nytimes.com/interactive/2016/11/15/travel/what-to-do-36-hours-in-miami-florida.html,https://static01.nyt.com/images/2016/11/20/travel/20MIAMI3/20MIAMI3-mediumSquare149.jpg?quality=100&auto=webp,"(25.7825287, -80.1299392)",11/15/2016
36 Hours in Toronto,"In this famously diverse city you’ll find an energetic food scene, vibrant street culture and cocktail wizardry.",Toronto,https://www.nytimes.com/interactive/2016/11/10/travel/what-to-do-36-hours-in-toronto.html,https://static01.nyt.com/images/2016/11/13/travel/13HOURSTORONTO-LISTY1/13HOURSTORONTO-LISTY1-mediumSquare149.jpg?quality=100&auto=webp,"(43.6534817, -79.3839347)",11/10/2016
"36 Hours in Manhattan, Below 59th Street",The center of the world — filled with restaurants and glamorous nightclubs — lies between Central Park and the Battery.,"Manhattan, Below 59th Street",https://www.nytimes.com/interactive/2016/11/03/travel/what-to-do-36-hours-manhattan-new-york-city.html,https://static01.nyt.com/images/2016/11/06/travel/06HOURS2/06HOURS2-mediumSquare149-v2.jpg?quality=100&auto=webp,,11/03/2016
36 Hours in Malta,"Many conquerors and countries have left their mark on this Mediterranean archipelago, and visitors will likely be entranced with the cultural mash-up.",Malta,https://www.nytimes.com/interactive/2016/10/21/travel/what-to-do-36-hours-in-malta.html,https://static01.nyt.com/images/2016/10/30/travel/30HOURS-MALTA1/30HOURS-MALTA1-mediumSquare149.jpg?quality=100&auto=webp,"(35.8885993, 14.4476911)",10/21/2016
"36 Hours in San Sebastián, Spain","Beyond the beach, this seaside resort’s enticements include art, architecture and, of course, dining on delectable small plates at pintxo bars.","San Sebastián, Spain",https://www.nytimes.com/interactive/2016/10/15/travel/what-to-do-36-hours-in-san-sebastian-spain.html,https://static01.nyt.com/images/2016/10/23/travel/23HOURS-SAN-SEBASTIAN5/23HOURS-SAN-SEBASTIAN5-mediumSquare149.jpg?quality=100&auto=webp,"(43.3224219, -1.9838889)",10/15/2016
"36 Hours in Asheville, N.C.","Mountain-ringed and progressively minded, the city that calls itself Land of the Sky is renowned for its creative spirit.","Asheville, N.C.",https://www.nytimes.com/interactive/2016/10/10/travel/what-to-do-36-hours-in-asheville-north-carolina.html,https://static01.nyt.com/images/2016/10/16/travel/16HOURS-ASHEVILLE1/16HOURS-ASHEVILLE1-mediumSquare149.jpg?quality=100&auto=webp,"(35.595363, -82.5508407)",10/10/2016
"36 Hours in Mumbai, India","Glamour hub, culinary capital, coastal metropolis: The teeming city of Mumbai has enough sights, glitter and art for everyone.","Mumbai, India",https://www.nytimes.com/interactive/2016/10/05/travel/what-to-do-36-hours-in-mumbai-india.html,https://static01.nyt.com/images/2016/10/09/travel/09HOURS-MUBAI-LISTY4/09HOURS-MUBAI-LISTY4-mediumSquare149.jpg?quality=100&auto=webp,"(19.054999, 72.8692035)",10/05/2016
"36 Hours in Richmond, Virginia","A new African-American museum, appealing parks and distinctive dining spots are among the lures of this riverside city.","Richmond, Virginia",https://www.nytimes.com/interactive/2016/09/17/travel/what-to-do-36-hours-in-richmond-virginia.html,https://static01.nyt.com/images/2016/10/02/travel/02HOURSListy2/02HOURSListy2-mediumSquare149-v2.jpg?quality=100&auto=webp,"(37.5385087, -77.43428)",09/17/2016
36 Hours in Edinburgh,"Where old and modern merge seamlessly: along with medieval alleys, design-forward buildings and a “new” Scottish cuisine.",Edinburgh,https://www.nytimes.com/interactive/2016/09/19/travel/what-to-do-36-hours-in-edinburgh.html,https://static01.nyt.com/images/2016/09/25/travel/25EDINBURGH1/25EDINBURGH1-mediumSquare149.jpg?quality=100&auto=webp,"(55.9533456, -3.1883749)",09/19/2016
"36 Hours in Burgundy, France","Show up hungry in Burgundy, and not just for boeuf Bourguignon. Appetites for art and design will be sated, too.","Burgundy, France",https://www.nytimes.com/interactive/2016/09/14/travel/what-to-do-36-hours-in-burgundy-france.html,https://static01.nyt.com/images/2016/09/18/travel/18HOURS-BURGUNDY/18HOURS-BURGUNDY-mediumSquare149.jpg?quality=100&auto=webp,"(47.2780873, 4.2224863)",09/14/2016
"36 Hours in Cambridge, Mass.","Anchored to the banks of the Charles River by Harvard and M.I.T., Cambridge blends its erudite character with a rich serving of arts and culture.","Cambridge, Mass.",https://www.nytimes.com/interactive/2016/09/08/travel/what-to-do-36-hours-in-cambridge-mass.html,https://static01.nyt.com/images/2016/09/11/travel/11HOURS2/11HOURS2-mediumSquare149.jpg?quality=100&auto=webp,"(42.3656347, -71.1040018)",09/08/2016
"36 Hours in the Cinque Terre, Italy","This wildly rugged slice of Ligurian coast with its five tiny towns is a delight for hikers, foodies and wine enthusiasts.","the Cinque Terre, Italy",https://www.nytimes.com/interactive/2016/09/01/travel/what-to-do-36-hours-in-the-cinque-terre-italy.html,https://static01.nyt.com/images/2016/09/04/travel/04CINQUE-TERRE-LISTY1/04CINQUE-TERRE-LISTY1-mediumSquare149.jpg?quality=100&auto=webp,,09/01/2016
36 Hours in Belgrade,"Epic night life, thriving cafe culture, hearty meals and emerging, design-conscious industrial districts: Belgrade has a gritty, distinctive appeal.",Belgrade,https://www.nytimes.com/interactive/2016/08/25/travel/what-to-do-36-hours-in-belgrade.html,https://static01.nyt.com/images/2016/08/28/travel/28HOURS-SERBIA-LISTY4/28HOURS-SERBIA-LISTY4-mediumSquare149.jpg?quality=100&auto=webp,"(44.8153318, 20.4456588)",08/25/2016
"36 Hours in Boulder, Colo.",Who even needs the legal marijuana? Boulder is an exceptionally easygoing place to hang out.,"Boulder, Colo.",https://www.nytimes.com/interactive/2016/08/18/travel/what-to-do-36-hours-boulder-colorado.html,https://static01.nyt.com/images/2016/08/21/travel/21HOURSLISTY1/21HOURSLISTY1-mediumSquare149.jpg?quality=100&auto=webp,"(40.0149856, -105.270545)",08/18/2016
36 Hours in Minneapolis,"Urban edginess, cultural authenticity, not to mention spiced meatballs in lingonberry sauce: the perfect formula for a weekend away.",Minneapolis,https://www.nytimes.com/interactive/2016/08/11/travel/what-to-do-36-hours-in-minneapolis.html,https://static01.nyt.com/images/2016/08/14/travel/14HOURS36-LISTY1/14HOURS36-LISTY1-mediumSquare149.jpg?quality=100&auto=webp,"(44.9772995, -93.2654692)",08/11/2016
"36 Hours in Nantucket, Mass.","Glorious public beaches, untouched moors and dunes, and sophisticated dining and shopping on this island off Cape Cod.","Nantucket, Mass.",https://www.nytimes.com/interactive/2016/08/04/travel/what-to-do-36-hours-in-nantucket-mass.html,https://static01.nyt.com/images/2016/08/07/travel/07HOURS1/07HOURS1-mediumSquare149.jpg?quality=100&auto=webp,"(41.2844408, -70.09842)",08/04/2016
"36 Hours in Portland, Me.","There’s more to this maritime city than great food: gracious parks, Victorian architecture and a thriving arts scene.","Portland, Me.",https://www.nytimes.com/interactive/2016/07/28/travel/what-to-do-36-hours-portland-me.html,https://static01.nyt.com/images/2016/07/31/travel/31HOURS-PORTLAND4/31HOURS-PORTLAND4-mediumSquare149.jpg?quality=100&auto=webp,"(43.6573605, -70.2586618)",07/28/2016
"36 Hours in Parma, Italy","This riverside city may be synonymous with fine food — Parma ham, Parmesan — but it also satisfies appetites for art, music and history.","Parma, Italy",https://www.nytimes.com/interactive/2016/07/21/travel/what-to-do-36-hours-parma-italy.html,https://static01.nyt.com/images/2016/07/24/travel/24HOURS1/24HOURS1-mediumSquare149.jpg?quality=100&auto=webp,"(44.6952006, 10.0979869)",07/21/2016
36 Hours on the Beach in Barcelona,"Dine seaside, sip cocktails high above the water or just stretch out in the sand during this coastal weekend in Catalonia.",Barcelona,https://www.nytimes.com/interactive/2016/07/15/travel/what-to-do-36-hours-barcelona.html,https://static01.nyt.com/images/2014/06/01/travel/01-hours-top/01-hours-top-mediumSquare149.jpg?quality=100&auto=webp,"(41.3825802, 2.177073)",07/15/2016
36 Hours in Cape Town,"A plan for this stunning city might include a 5K run (or walk), browsing farm markets, dinner at a wine estate and, no surprise, heading up Table Mountain (by cable car).",Cape Town,https://www.nytimes.com/interactive/2016/07/15/travel/what-to-do-36-hours-in-capetown.html,https://static01.nyt.com/images/2015/10/25/travel/25HOURS2/25HOURS2-mediumSquare149.jpg?quality=100&auto=webp,"(-33.9288301, 18.4172197)",07/15/2016
"36 Hours on the Left Bank, Paris","The Right Bank may be more international and trendy, but sometimes you want to pretend you’re inside a black-and-white Robert Doisneau photo.","the Left Bank, Paris",https://www.nytimes.com/interactive/2016/07/15/travel/what-to-do-36-hours-paris-left-bank.html,https://static01.nyt.com/images/2015/04/19/travel/19HOURS2/19HOURS2-mediumSquare149.jpg?quality=100&auto=webp,"(46.8389621, 29.6170107)",07/15/2016
"36 Hours in Charleston, S.C.","The city is in the midst of a restaurant boom, and King Street has become the embodiment of a new, saccharine-free Southern charm.","Charleston, S.C.",https://www.nytimes.com/interactive/2016/07/15/travel/what-to-do-36-hours-charleston.html,https://static01.nyt.com/images/2013/11/24/travel/24charleston-slide-96TF/24charleston-slide-96TF-moth.jpg?quality=100&auto=webp,"(32.7884363, -79.9399309)",07/15/2016
36 Hours in Seoul,"Thanks to the Korean pop culture wave, the once underrated South Korean capital, with its new museums, plazas and restaurants, is reveling in a tourism boom.",Seoul,https://www.nytimes.com/interactive/2016/07/15/travel/what-to-do-36-hours-in-seoul.html,https://static01.nyt.com/images/2016/07/17/travel/17HOURS2/17HOURS2-mediumSquare149-v2.jpg?quality=100&auto=webp,"(37.5666791, 126.9782914)",07/15/2016
"36 Hours in Helsinki, Finland","Every corner of this cool Nordic city is heating up, with a renewed waterfront, renovated museums and revived industrial spaces.","Helsinki, Finland",https://www.nytimes.com/interactive/2016/07/07/travel/what-to-do-36-hours-helsinki-finland.html,https://static01.nyt.com/images/2016/07/10/travel/10HOURS3/10HOURS3-mediumSquare149.jpg?quality=100&auto=webp,"(60.1666204, 24.9435408)",07/07/2016
36 Hours in Cleveland,"Whatever the fallout from the forthcoming Republican National Convention, Cleveland, with its booming food scene and revitalized downtown, is camera ready.",Cleveland,https://www.nytimes.com/interactive/2016/06/29/travel/what-to-do-36-hours-cleveland.html,https://static01.nyt.com/images/2016/07/03/travel/03HOURS-CLEVELAND7/03HOURS-CLEVELAND7-mediumSquare149.jpg?quality=100&auto=webp,"(41.4996574, -81.6936772)",06/29/2016
"36 Hours in Valencia, Spain",Artistic and culinary innovation continue to transform every corner of this perpetually sunny city.,"Valencia, Spain",https://www.nytimes.com/interactive/2016/06/22/travel/what-to-do-36-hours-valencia-spain.html,https://static01.nyt.com/images/2016/06/26/travel/26HOURSLISTY-VALENCIA5/26HOURSLISTY-VALENCIA5-mediumSquare149.jpg?quality=100&auto=webp,"(39.4697065, -0.3763353)",06/22/2016
36 Hours in Chicago,The neighborhoods on Chicago’s near northwest side are an invigorating blend of reflection and reinvention.,Chicago,https://www.nytimes.com/interactive/2016/06/16/travel/what-to-do-36-hours-chicago.html,https://static01.nyt.com/images/2016/06/05/travel/05HOURS-CHICAGO1_LISTY/05HOURS-CHICAGO1_LISTY-mediumSquare149.jpg?quality=100&auto=webp,"(41.8755616, -87.6244212)",06/16/2016
36 Hours in Los Angeles,"Home to captivating art, deeply rooted ethnic communities and world-class food, the nation’s second largest city is vivid, soulful and eclectic.",Los Angeles,https://www.nytimes.com/interactive/2016/06/10/travel/what-to-do-36-hours-los-angeles.html,https://static01.nyt.com/images/2016/06/12/travel/12HOURS-LA1/12HOURS-LA1-mediumSquare149.jpg?quality=100&auto=webp,"(34.0536909, -118.242766)",06/10/2016
36 Hours in Philadelphia,"With the Democratic National Convention to be held here this summer, Philadelphia has never been more ready to show itself off to the world.",Philadelphia,https://www.nytimes.com/interactive/2016/05/26/travel/what-to-do-36-hours-in-philadelphia.html,https://static01.nyt.com/images/2016/05/29/travel/29HOURS-PHILA2_LISTY/29HOURS-PHILA2_LISTY-mediumSquare149.jpg?quality=100&auto=webp,"(39.9527237, -75.1635262)",05/26/2016
36 Hours on Oahu,"Beyond the island’s densely populated south shore, you’ll find a heady mix of rugged natural beauty and a rich cultural heritage.",Oahu,https://www.nytimes.com/interactive/2016/05/19/travel/what-to-do-36-hours-oahu.html,https://static01.nyt.com/images/2016/05/22/travel/22HOURSLISTY1/22HOURSLISTY1-mediumSquare149.jpg?quality=100&auto=webp,"(21.4834365, -158.0364837)",05/19/2016
36 Hours in Amsterdam,"With new restaurants and night spots, and the reopening of the Rijksmuseum and the Stedelijk Museum, Amsterdam is in the midst of an exciting renewal.",Amsterdam,https://www.nytimes.com/interactive/2016/05/12/travel/what-to-do-36-hours-in-amsterdam.html,https://static01.nyt.com/images/2016/05/15/travel/15HOURS-LISTY3/15HOURS-LISTY3-mediumSquare149.jpg?quality=100&auto=webp,"(52.3730796, 4.8924534)",05/12/2016
36 Hours in Southeast London,"The neighborhoods in Southeast London are among the capital’s most energetic, with lively streets, tempting restaurants and a spooky cemetery.",Southeast London,https://www.nytimes.com/interactive/2016/05/05/travel/what-to-do-36-hours-in-southeast-london.html,https://static01.nyt.com/images/2016/05/08/travel/08HOURS1-LISTY/08HOURS1-LISTY-mediumSquare149.jpg?quality=100&auto=webp,"(-22.582498, -47.3872849)",05/05/2016
36 Hours in Louisville,"Brandy distilleries, “hot” chicken, cool shops and theater: There’s more to Louisville than horse racing and bourbon.",Louisville,https://www.nytimes.com/interactive/2016/04/28/travel/what-to-do-36-hours-in-louisville.html,https://static01.nyt.com/images/2016/05/01/travel/01HOURS1_LISTY/01HOURS1_LISTY-mediumSquare149.jpg?quality=100&auto=webp,"(38.2542376, -85.759407)",04/28/2016
36 Hours on the Amalfi Coast,"Seek out the less-heralded towns on this 30-mile stretch of Italian coast, and discover the untrammeled charm that drew the likes of John Steinbeck.",the Amalfi Coast,https://www.nytimes.com/interactive/2016/04/21/travel/what-to-do-36-hours-amalfi-coast.html,https://static01.nyt.com/images/2016/04/24/travel/24HOURS1_LISTY/24HOURS1_LISTY-mediumSquare149.jpg?quality=100&auto=webp,"(36.0953036, -114.914314)",04/21/2016
36 Hours in Tangier,"The Moroccan port city that lured Paul Bowles and Jean Genet is in turnaround mode, but its classic draws — iconic cafes, long beaches — remain.",Tangier,https://www.nytimes.com/interactive/2016/04/15/travel/what-to-do-36-hours-in-tangier-morocco.html,https://static01.nyt.com/images/2016/04/17/travel/17HOURS1_LISTY/17HOURS1_LISTY-mediumSquare149.jpg?quality=100&auto=webp,"(35.7696302, -5.8033522)",04/15/2016
"36 Hours in Hyderabad, India","As this high-tech capital marches steadily into the future, visitors should not forget the city’s regal past — nor its celebrated culinary offerings.","Hyderabad, India",https://www.nytimes.com/interactive/2016/04/07/travel/what-to-do-36-hours-hyderabad-india.html,https://static01.nyt.com/images/2016/04/10/travel/10-36HYDERABADLISTY1/10-36HYDERABADLISTY1-mediumSquare149.jpg?quality=100&auto=webp,"(17.360589, 78.4740613)",04/07/2016
"36 Hours in Galway, Ireland","Welcoming and walkable and filled to the brim with old-fashioned pubs and excellent seafood restaurants, scenic Galway may be Ireland’s most charming city.","Galway, Ireland",https://www.nytimes.com/interactive/2016/03/31/travel/what-to-do-36-hours-in-galway-ireland.html,https://static01.nyt.com/images/2016/04/03/travel/03HOURS1/03HOURS1-mediumSquare149.jpg?quality=100&auto=webp,"(53.2744122, -9.0490601)",03/31/2016
36 Hours in Hong Kong,A booming art scene and exciting culinary endeavors keep ever-changing Hong Kong in the spotlight.,Hong Kong,https://www.nytimes.com/interactive/2016/03/24/travel/what-to-do-36-hours-in-hong-kong.html,https://static01.nyt.com/images/2016/03/27/travel/27HOURS1/27HOURS1-mediumSquare149-v2.jpg?quality=100&auto=webp,"(22.350627, 114.1849161)",03/24/2016
36 Hours in Mexico City,"The Mexican capital is more cosmopolitan than ever, with world-class museums, vibrant street art, top-notch restaurants and bustling markets.",Mexico City,https://www.nytimes.com/interactive/2016/03/17/travel/what-to-do-in-36-hours-in-mexico-city.html,https://static01.nyt.com/images/2016/03/20/travel/30HOURS1/30HOURS1-mediumSquare149.jpg?quality=100&auto=webp,"(19.4326296, -99.1331785)",03/17/2016
36 Hours in Zurich,"To a yearlong celebration of the centenary of Dada, you can add first-rate restaurants, Art Deco bars and a lake cruise with views of the Alps.",Zurich,https://www.nytimes.com/interactive/2016/03/10/travel/what-to-do-in-36-hours-in-zurich.html,https://static01.nyt.com/images/2016/03/13/travel/13ZURICH1/13ZURICH1-mediumSquare149.jpg?quality=100&auto=webp,"(47.3744489, 8.5410422)",03/10/2016
"36 Hours in Austin, Texas","Beyond the SXSW festival, there’s classic barbecue, contemporary art and even a beer garden on a working ranch.","Austin, Texas",https://www.nytimes.com/interactive/2016/03/04/travel/what-to-do-in-36-hours-in-austin-texas.html,https://static01.nyt.com/images/2016/03/03/travel/06HOURS4/06HOURS4-mediumSquare149.jpg?quality=100&auto=webp,"(30.2711286, -97.7436995)",03/04/2016
"36 Hours in Palm Springs, California","The city's midcentury modern architecture, which effortlessly blends desert and design, is all the rage.","Palm Springs, California",https://www.nytimes.com/interactive/2016/02/25/travel/what-to-do-in-36-hours-in-palm-springs-california.html,https://static01.nyt.com/images/2016/02/26/travel/28HOURS4/28HOURS4-mediumSquare149.jpg?quality=100&auto=webp,"(33.8246269, -116.540303)",02/25/2016
"36 Hours in Pasadena, California","Beyond its well-known cultural institutions, this sunny city offers distinctive architecture, a venerable playhouse and beloved shops.","Pasadena, California",https://www.nytimes.com/interactive/2016/02/18/travel/what-to-do-in-36-hours-in-pasadena-california.html,https://static01.nyt.com/images/2016/02/18/travel/21hours4/21hours4-mediumSquare149-v3.jpg?quality=100&auto=webp,"(34.1476507, -118.144155)",02/18/2016
36 Hours in Houston,"America’s youngest city offers a potpourri pot of cuisines, quirky shops and art with both global and local reach.",Houston,https://www.nytimes.com/interactive/2016/02/11/travel/what-to-do-in-36-hours-in-houston.html,https://static01.nyt.com/images/2016/02/12/travel/14hours5/14hours5-mediumSquare149.jpg?quality=100&auto=webp,"(29.7589382, -95.3676974)",02/11/2016
"36 Hours in Aspen, Colorado","A winter wonderland that combines the wilderness experience with skiing, snowboarding, shopping and dining, that can be enjoyed without breaking the bank.","Aspen, Colorado",https://www.nytimes.com/interactive/2016/02/03/travel/what-to-do-in-36-hours-in-aspen-colorado.html,https://static01.nyt.com/images/2016/02/07/travel/07HOURS2/07HOURS2-mediumSquare149-v2.jpg?quality=100&auto=webp,"(39.1911128, -106.82356)",02/03/2016
"36 Hours in Porto, Portugal","From its stunning Beaux-Arts station to its cool bars serving Porto’s signature drink, this charming city combines the best of old and new.","Porto, Portugal",https://www.nytimes.com/interactive/2016/01/28/travel/what-to-do-in-36-hours-in-porto-portugal.html,https://static01.nyt.com/images/2016/01/31/travel/31HOURS/31HOURS-mediumSquare149.jpg?quality=100&auto=webp,"(41.1502195, -8.6103497)",01/28/2016
"36 Hours in Santo Domingo, Dominican Republic","More than simply a base for the beaches, this energetic city combines a vibrant night life with graceful, centuries-old buildings.","Santo Domingo, Dominican Republic",https://www.nytimes.com/interactive/2016/01/18/travel/36-hours-in-santo-domingo-dominican-republic.html,https://static01.nyt.com/images/2016/01/24/travel/24HOURS2/24HOURS2-mediumSquare149.jpg?quality=100&auto=webp,"(18.4713858, -69.8918436)",01/18/2016
36 Hours in Quebec City,"In Quebec’s capital, hip and historic exist side by side, with cultural and culinary enticements for all manner of visitors.",Quebec City,https://www.nytimes.com/interactive/2016/01/13/travel/what-to-do-in-36-hours-in-quebec-city.html,https://static01.nyt.com/images/2016/01/17/travel/17HOURS1/17HOURS1-mediumSquare149-v2.jpg?quality=100&auto=webp,"(46.8137431, -71.2084061)",01/13/2016
36 Hours in Havana,"This confounding capital, a mix of past and present, freedom and restriction, has come alive with new energy and ingenuity.",Havana,https://www.nytimes.com/interactive/2016/01/06/travel/what-to-do-in-36-hours-in-havana-cuba.html,https://static01.nyt.com/images/2016/01/10/travel/10HOURS1/10HOURS1-mediumSquare149.jpg?quality=100&auto=webp,"(23.135305, -82.3589631)",01/06/2016
36 Hours in Tel Aviv,"Young, modern Tel Aviv and ancient Jaffa pulse with energy and combine to offer bustling markets, night clubs and a beachside promenade just right for two wheels.",Tel Aviv,https://www.nytimes.com/interactive/2015/12/30/travel/what-to-do-in-36-hours-in-tel-aviv.html,https://static01.nyt.com/images/2016/01/03/travel/3HOURS2/3HOURS2-mediumSquare149-v2.jpg?quality=100&auto=webp,"(32.0852997, 34.7818064)",12/30/2015
"36 Hours in Warsaw, Poland",The city is positioning itself as Eastern Europe’s chic cultural capital with thriving art and club scenes and serious restaurants.,"Warsaw, Poland",https://www.nytimes.com/interactive/2015/12/22/travel/what-to-do-in-36-hours-in-warsaw-poland.html,https://static01.nyt.com/images/2015/12/27/travel/27WARSAW1/27WARSAW1-mediumSquare149.jpg?quality=100&auto=webp,"(52.2333742, 21.0711489)",12/22/2015
"36 Hours in Palermo, Sicily","Palazzi housing art and nightlife, dazzling churches and cozy osterias are highlights in this colorful port town.","Palermo, Sicily",https://www.nytimes.com/interactive/2015/12/18/travel/what-to-do-in-36-hours-in-palermo-sicily.html,https://static01.nyt.com/images/2015/12/20/travel/20HOURS1/20HOURS1-mediumSquare149.jpg?quality=100&auto=webp,"(38.1112268, 13.3524434)",12/18/2015
"36 Hours in Telluride, Colorado","Besides its natural beauty and uncrowded slopes, this “skier’s mountain” has a quirky culture of friendly, relaxed fans of the great outdoors.","Telluride, Colorado",https://www.nytimes.com/interactive/2015/12/10/travel/what-to-do-in-36-hours-in-telluride-colorado.html,https://static01.nyt.com/images/2015/12/13/travel/13TELLURIDELISTY5/13TELLURIDELISTY5-mediumSquare149.jpg?quality=100&auto=webp,"(37.9374939, -107.812285)",12/10/2015
"36 Hours in Oakland, California","Long overshadowed by its dolled-up big sister across the Bay, Oakland is its own town, and its cultural heterogeneity remains its greatest strength.","Oakland, California",https://www.nytimes.com/interactive/2015/12/02/travel/what-to-do-in-36-hours-in-oakland-california.html,https://static01.nyt.com/images/2015/12/06/travel/0636HOURSLISTY1sub/0636HOURSLISTY1-mediumSquare149.jpg?quality=100&auto=webp,"(37.8044557, -122.271356)",12/02/2015
"36 Hours in Adelaide, Australia","No longer simply a stop on the way to its celebrated wine region, the city has seen a revival of cafes and an arts scene, among other draws.","Adelaide, Australia",https://www.nytimes.com/interactive/2015/11/27/travel/what-to-do-in-36-hours-in-adelaide-australia.html,https://static01.nyt.com/images/2015/11/29/travel/29HOURS3/29HOURS3-mediumSquare149-v3.jpg?quality=100&auto=webp,"(-34.9281805, 138.5999312)",11/27/2015
36 Hours in Montreal,"Whether you want to embrace the season on rinks, trails or runs, or dodge the cold and head to the spa, this vibrant city has it all.",Montreal,https://www.nytimes.com/interactive/2015/11/19/travel/what-to-do-in-36-hours-in-montreal.html,https://static01.nyt.com/images/2015/11/22/travel/22HOURSCOVER/22HOURSCOVER-mediumSquare149-v2.jpg?quality=100&auto=webp,"(45.5031824, -73.5698065)",11/19/2015
